{"capturedThrough":{"at":"2026-08-13T00:00:00Z","cursor":"0000000000000001"},"profile":"https://spec.jinn.network/profiles/benchmark-observation-archive/v1","streams":[{"authority":"authoritative","conflicts":[],"exactEnvelopes":[{"digest":{"sha256":"aaaaaaaaaaaaaaaaaaaaaaaaaaaaaaaaaaaaaaaaaaaaaaaaaaaaaaaaaaaaaaaa"},"name":"sealed"}],"observations":[{"data":{"attempt":"urn:uuid:aaaaaaaa-aaaa-5aaa-8aaa-aaaaaaaaaaaa","dispatchContext":{"digest":{"sha256":"aaaaaaaaaaaaaaaaaaaaaaaaaaaaaaaaaaaaaaaaaaaaaaaaaaaaaaaaaaaaaaaa"},"name":"sealed"},"effectiveDeadline":"2026-08-14T00:00:00Z","source":"https://backend.example/observations","submission":"urn:uuid:bbbbbbbb-bbbb-5bbb-8bbb-bbbbbbbbbbbb","task":"sha256:aaaaaaaaaaaaaaaaaaaaaaaaaaaaaaaaaaaaaaaaaaaaaaaaaaaaaaaaaaaaaaaa"},"datacontenttype":"application/json","id":"engaged","sequence":"0000000000000001","source":"https://backend.example/observations","specversion":"1.0","subject":"urn:uuid:aaaaaaaa-aaaa-5aaa-8aaa-aaaaaaaaaaaa","time":"2026-08-13T00:00:00Z","type":"network.jinn.task-execution.attempt-engaged.v1"}],"source":"https://backend.example/observations","subject":"urn:uuid:aaaaaaaa-aaaa-5aaa-8aaa-aaaaaaaaaaaa"}],"submission":{"digest":{"sha256":"aaaaaaaaaaaaaaaaaaaaaaaaaaaaaaaaaaaaaaaaaaaaaaaaaaaaaaaaaaaaaaaa"},"name":"sealed"}}